question,answers,top_uris
"What safety measures should be taken during the initial start-up of a machine unit that are different from normal operation, and who is authorized to perform this task?","['14948383499.html', '20503717003.html']","['1494832410762079730315.html', '1494839629962079824779.html', '1494839629962079824779.html', '1494839220362079802763.html', '1494839220362079802763.html']"
How should the oil cooler be serviced and vented properly to prevent coolant from entering the oil circuit in case of a leak?,"['14948383499.html', '20503717003.html']","['65293547147.html', '65293547147.html', '1513352781962079978763.html', '1513352781962079978763.html']"
"What are the required steps for testing the automatic activation of the auxiliary oil pump, and what actions should be taken if the oil pressure is insufficient?","['14948383499.html', '20503717003.html']","['15047812235.html', '62924230027.html', '1495056244362079543307.html', '1508675572362079879819.html', '1504039924362208843531.html']"
"What specific safety precautions and protective measures must be implemented when operating a machine unit with high pressures, temperatures, and potentially hazardous media?","['14948383499.html', '20503717003.html']","['1510410689162079423627.html', '63150208011.html', '1509612532362079402891.html']"
"What is the proper procedure for performing a normal shutdown of the machine train, and what manual steps must be taken after the automated shutdown sequence is complete?","['14948383499.html', '20503717003.html']","['62205930251.html', '62079869835.html', '73600881675.html', '1508676634762079937547.html']"
"What safety measures should be taken during the initial start-up of a machine unit that are different from normal operation, and who is authorized to perform this start-up?","['65276680331.html', '62817154571.html']","['1494832410762079730315.html', '1494839629962079824779.html', '1494839629962079824779.html', '1494839220362079802763.html', '1494839220362079802763.html']"
"How should the oil system and seal gas system be sequenced during startup to prevent oil contamination in the process gas, and what specific conditions must be met before activating the auxiliary oil pump?","['65276680331.html', '62817154571.html']","['62204702091.html', '62079869835.html', '1508675572362079879819.html', '62204702091.html']"
"What are the required steps for properly venting both the oil and water sides of an oil cooler during commissioning or after maintenance, and why is the sequence of filling important?","['65276680331.html', '62817154571.html']","['65293547147.html', '1513352781962079978763.html', '1513352781962079978763.html']"
"What procedures should be followed when the differential pressure across the oil filter becomes too high, and how does this relate to the hazard zones defined in the machine unit documentation?","['65276680331.html', '62817154571.html']","['62938365451.html', '1510864129162080027403.html', '62918873227.html']"
"What are the responsibilities of MAN Energy Solutions personnel versus the operating company during commissioning, and what specific documentation must be created together before handover?","['65276680331.html', '62817154571.html']","['1494832410762079730315.html', '00_doc001.pdf', '00_doc001.pdf', '00_doc001.pdf', '1494838759562079849867.html']"
